{
  "$schema": "https://json-schema.org/draft/2020-12/schema",
  "$id": "https://github.com/kody-w/rapp-1/blob/main/trust/registry-candidate.schema.json",
  "title": "RAPP/1 unsigned or owner-signed registry candidate",
  "type": "object",
  "additionalProperties": false,
  "required": [
    "schema",
    "registry_version",
    "status",
    "estate",
    "issued_utc",
    "registry_seq",
    "previous_registry_hash",
    "canonical_source",
    "provenance",
    "frame",
    "algorithms",
    "owners",
    "rappids",
    "keys",
    "kinds",
    "egg_variants",
    "tombstones",
    "re_anchors",
    "sig"
  ],
  "properties": {
    "schema": {"const": "rapp/1-registry-candidate"},
    "registry_version": {"const": 1},
    "status": {"enum": ["unsigned-candidate", "owner-signed"]},
    "estate": {"type": "string", "pattern": "^[a-z0-9]+(?:-[a-z0-9]+)*$"},
    "issued_utc": {"$ref": "#/$defs/utc"},
    "registry_seq": {"type": ["integer", "null"], "minimum": 0, "maximum": 9007199254740991},
    "previous_registry_hash": {"$ref": "#/$defs/nullOrHash"},
    "canonical_source": {
      "type": "object",
      "additionalProperties": false,
      "required": ["repo", "path", "commit", "retrieval_status"],
      "properties": {
        "repo": {"const": "https://github.com/kody-w/RAPP"},
        "path": {"const": "rapp-map/ecosystem-spec.json"},
        "commit": {"type": ["string", "null"], "pattern": "^[0-9a-f]{40}$"},
        "retrieval_status": {"enum": ["pinned", "unavailable"]}
      }
    },
    "provenance": {
      "type": "object",
      "additionalProperties": false,
      "required": [
        "proposal_repo",
        "base_commit",
        "base_tree",
        "spec_path",
        "spec_commit",
        "spec_sha256",
        "anchor_path",
        "anchor_stream_id",
        "anchor_seq",
        "anchor_frame_hash",
        "anchor_feed",
        "feed_role"
      ],
      "properties": {
        "proposal_repo": {"const": "https://github.com/kody-w/rapp-1"},
        "base_commit": {"$ref": "#/$defs/commit"},
        "base_tree": {"$ref": "#/$defs/gitObject"},
        "spec_path": {"const": "SPEC.md"},
        "spec_commit": {"$ref": "#/$defs/commit"},
        "spec_sha256": {"$ref": "#/$defs/hash"},
        "anchor_path": {"const": "anchor/chain.jsonl"},
        "anchor_stream_id": {"$ref": "#/$defs/rappid"},
        "anchor_seq": {"type": "integer", "minimum": 0, "maximum": 9007199254740991},
        "anchor_frame_hash": {"$ref": "#/$defs/hash"},
        "anchor_feed": {"const": "https://github.com/kody-w/rapp-1/commits/main/anchor.atom"},
        "feed_role": {"const": "discovery-only-pull-and-verify-chain"}
      }
    },
    "frame": {
      "type": "object",
      "additionalProperties": false,
      "required": ["spec", "keys", "hash_space"],
      "properties": {
        "spec": {"const": "rapp/1"},
        "keys": {
          "prefixItems": [
            {"const": "spec"},
            {"const": "kind"},
            {"const": "stream_id"},
            {"const": "seq"},
            {"const": "utc"},
            {"const": "payload"},
            {"const": "payload_hash"},
            {"const": "prev"},
            {"const": "prev_wave"},
            {"const": "sig"},
            {"const": "frame_hash"}
          ],
          "items": false
        },
        "hash_space": {"const": "rapp/1:wave"}
      }
    },
    "algorithms": {"const": ["EdDSA"]},
    "owners": {
      "type": "array",
      "items": {
        "type": "object",
        "additionalProperties": false,
        "required": ["rappid", "valid_from_utc", "valid_until_utc"],
        "properties": {
          "rappid": {"$ref": "#/$defs/rappid"},
          "valid_from_utc": {"$ref": "#/$defs/utc"},
          "valid_until_utc": {"oneOf": [{"$ref": "#/$defs/utc"}, {"type": "null"}]}
        }
      }
    },
    "rappids": {
      "type": "array",
      "items": {
        "type": "object",
        "additionalProperties": false,
        "required": ["rappid", "role", "minted_utc", "grown_from"],
        "properties": {
          "rappid": {"$ref": "#/$defs/rappid"},
          "role": {"enum": ["estate_owner", "producer", "router", "mirror"]},
          "minted_utc": {"$ref": "#/$defs/utc"},
          "grown_from": {"$ref": "#/$defs/nullOrHash"}
        }
      }
    },
    "keys": {
      "type": "array",
      "items": {
        "type": "object",
        "additionalProperties": false,
        "required": ["kid", "alg", "spki_der_b64", "not_before_utc", "not_after_utc", "deprecated"],
        "properties": {
          "kid": {"$ref": "#/$defs/rappid"},
          "alg": {"const": "EdDSA"},
          "spki_der_b64": {"type": "string", "contentEncoding": "base64"},
          "not_before_utc": {"$ref": "#/$defs/utc"},
          "not_after_utc": {"oneOf": [{"$ref": "#/$defs/utc"}, {"type": "null"}]},
          "deprecated": {"type": "boolean"}
        }
      }
    },
    "kinds": {
      "type": "array",
      "items": {
        "type": "object",
        "additionalProperties": false,
        "required": ["kind", "family", "deprecated"],
        "properties": {
          "kind": {"type": "string", "pattern": "^[a-z0-9]+(?:-[a-z0-9]+)*\\.[a-z0-9]+(?:-[a-z0-9]+)*$"},
          "family": {"enum": ["memory", "body", "swarm"]},
          "deprecated": {"type": "boolean"}
        }
      }
    },
    "egg_variants": {
      "type": "array",
      "items": {
        "type": "object",
        "additionalProperties": false,
        "required": ["variant", "deprecated"],
        "properties": {
          "variant": {"type": "string", "pattern": "^[a-z0-9]+(?:-[a-z0-9]+)*$"},
          "deprecated": {"type": "boolean"}
        }
      }
    },
    "tombstones": {
      "type": "array",
      "items": {
        "type": "object",
        "additionalProperties": false,
        "required": ["rappid", "revoked_utc", "sig"],
        "properties": {
          "rappid": {"$ref": "#/$defs/rappid"},
          "revoked_utc": {"$ref": "#/$defs/utc"},
          "sig": {"type": "string"}
        }
      }
    },
    "re_anchors": {
      "type": "array",
      "items": {
        "type": "object",
        "additionalProperties": false,
        "required": ["old_rappid", "new_rappid", "case", "utc", "sig", "old_key_sig"],
        "properties": {
          "old_rappid": {"$ref": "#/$defs/rappid"},
          "new_rappid": {"$ref": "#/$defs/rappid"},
          "case": {"enum": ["upgrade", "rotation", "compromise", "tag-migrate"]},
          "utc": {"$ref": "#/$defs/utc"},
          "sig": {"type": "string"},
          "old_key_sig": {"type": ["string", "null"]}
        }
      }
    },
    "sig": {"type": ["string", "null"]}
  },
  "allOf": [
    {
      "if": {"properties": {"status": {"const": "unsigned-candidate"}}},
      "then": {"properties": {"registry_seq": {"type": "null"}, "sig": {"type": "null"}}}
    },
    {
      "if": {"properties": {"status": {"const": "owner-signed"}}},
      "then": {"properties": {"registry_seq": {"type": "integer"}, "sig": {"type": "string"}}}
    }
  ],
  "$defs": {
    "hash": {"type": "string", "pattern": "^[0-9a-f]{64}$"},
    "nullOrHash": {"oneOf": [{"$ref": "#/$defs/hash"}, {"type": "null"}]},
    "commit": {"$ref": "#/$defs/gitObject"},
    "gitObject": {"type": "string", "pattern": "^[0-9a-f]{40}$"},
    "rappid": {
      "type": "string",
      "pattern": "^rappid:@[a-z0-9]+(?:-[a-z0-9]+)*/[a-z0-9]+(?:-[a-z0-9]+)*:[0-9a-f]{64}$"
    },
    "utc": {
      "type": "string",
      "pattern": "^\\d{4}-\\d{2}-\\d{2}T\\d{2}:\\d{2}:\\d{2}\\.\\d{3}Z$"
    }
  }
}
